[{"evidence_id":"evidence:synthetic_meridian_note:1","note":"Synthetic demonstration evidence; not a historical claim.","page_end":null,"page_start":null,"page_status":"not_paginated","quote":"Professor Bora Example supervised Aylin Demo's doctoral work.","quote_sha256":"fef6d974537c1da03e524f1a8ef79a4d325c2f74e310dd8f8d3c0d40753b057c","source_id":"source:synthetic_meridian_note","source_sha256":"87abdce55610c805edcbb0f169c54de090c66ac7690652163b221d013a88eadd","text_artifact_sha256":"c2384202e233a9dcb311ddd4ea7650a358d7bc444965f04b32e1517c4fd0f0d6","verification":{"char_end":98,"char_start":37,"match_count":1,"matched_text_sha256":"fef6d974537c1da03e524f1a8ef79a4d325c2f74e310dd8f8d3c0d40753b057c","method":"exact-v1","normalization_profile_version":null,"page_number":1,"reason":null,"status":"exact_match","verifier":"code:verify-quotes-v1"}},{"evidence_id":"evidence:synthetic_meridian_note:2","note":"Synthetic demonstration evidence; not a historical claim.","page_end":null,"page_start":null,"page_status":"not_paginated","quote":"Aylin Demo and Bora Example later co-authored the imaginary paper \"Gardens of Symmetry\".","quote_sha256":"bcf03281b2c98adccdf884e3a45a754287aac9f3e7213ca2bb8766fc9c0378b0","source_id":"source:synthetic_meridian_note","source_sha256":"87abdce55610c805edcbb0f169c54de090c66ac7690652163b221d013a88eadd","text_artifact_sha256":"c2384202e233a9dcb311ddd4ea7650a358d7bc444965f04b32e1517c4fd0f0d6","verification":{"char_end":187,"char_start":99,"match_count":1,"matched_text_sha256":"bcf03281b2c98adccdf884e3a45a754287aac9f3e7213ca2bb8766fc9c0378b0","method":"exact-v1","normalization_profile_version":null,"page_number":1,"reason":null,"status":"exact_match","verifier":"code:verify-quotes-v1"}},{"evidence_id":"evidence:synthetic_meridian_note:3","note":"Synthetic demonstration evidence; not a historical claim.","page_end":null,"page_start":null,"page_status":"not_paginated","quote":"Aylin Demo and Cem Sample appeared together at the fictional Solstice Mathematics Workshop.","quote_sha256":"e3de5122253da0bb5f9253a0e3012f8453c42dd92ce81b65cd64a4694fa8818b","source_id":"source:synthetic_meridian_note","source_sha256":"87abdce55610c805edcbb0f169c54de090c66ac7690652163b221d013a88eadd","text_artifact_sha256":"c2384202e233a9dcb311ddd4ea7650a358d7bc444965f04b32e1517c4fd0f0d6","verification":{"char_end":279,"char_start":188,"match_count":1,"matched_text_sha256":"e3de5122253da0bb5f9253a0e3012f8453c42dd92ce81b65cd64a4694fa8818b","method":"exact-v1","normalization_profile_version":null,"page_number":1,"reason":null,"status":"exact_match","verifier":"code:verify-quotes-v1"}}]
